{
  "advisors": [
    {
      "claims": [
        {
          "claim": "The milestone fixes first-run contributor bootstrap and prevents generated dependency/build outputs from polluting product diffs.",
          "evidence": "The charter and AC-001 require npm ci, UI typecheck/build, and clean git status for generated outputs.",
          "falsifier": "If the install failure is only local environment state or generated outputs are already ignored on a clean checkout, the milestone has no repository value.",
          "stance": "SUPPORT",
          "topic_key": "mission-value"
        },
        {
          "claim": "The milestone is feasible as a small metadata change if the broken path is lockfile or ignore metadata.",
          "evidence": "The charter permits behavior-preserving metadata fixes and pivots if package-manager strategy must change.",
          "falsifier": "If npm ci cannot be made reproducible from the existing npm lockfile without changing package manager or dependency strategy, do not proceed.",
          "stance": "SUPPORT",
          "topic_key": "feasibility"
        },
        {
          "claim": "The proof standard is sufficient because it checks install, typecheck, production build, repo tests, repo checks, and generated-output cleanliness.",
          "evidence": "The charter names npm ci, npm run typecheck, npm run build:web, python3 scripts/test.py, python3 scripts/check_repo.py, and git status --short.",
          "falsifier": "If those commands pass only because of local caches or pre-existing untracked state, the proof is insufficient.",
          "stance": "SUPPORT",
          "topic_key": "proof-sufficiency"
        },
        {
          "claim": "The smallest scope is lockfile reproducibility plus ignore coverage for generated dependency/build outputs.",
          "evidence": "The charter excludes UI redesign, state-machine changes, package-manager changes, and Python runtime dependency changes.",
          "falsifier": "If the patch touches UI behavior, protocol gates, runtime dependencies, or package-manager strategy, it is no longer minimal.",
          "stance": "SUPPORT",
          "topic_key": "scope-minimality"
        }
      ],
      "cut": "Cut UI redesign, state-machine changes, package-manager changes, runtime dependency changes, and unrelated cleanup.",
      "first_move": "Inspect npm ci failure evidence and git status, then change only the lockfile or ignore rules needed.",
      "identity": {
        "context_id": "council-advisor-1-context",
        "model": "current",
        "participant_id": "advisor-1",
        "provider": "codex-multi-agent"
      },
      "independent_first_round": true,
      "null_hypothesis": "Do not proceed if the npm install failure is local environment state rather than repository metadata.",
      "verdict": "PROCEED"
    },
    {
      "claims": [
        {
          "claim": "The milestone removes a first-run contributor blocker and prevents generated dependency/build artifacts from looking like product changes.",
          "evidence": "GOAL.txt and CHARTER.md define success as clone, npm ci, UI checks, production build, and clean generated-output status.",
          "falsifier": "If npm ci already works from the public lockfile and generated outputs are already ignored on a clean checkout, the milestone has no remaining value.",
          "stance": "SUPPORT",
          "topic_key": "mission-value"
        },
        {
          "claim": "The milestone is feasible if the failure is repository metadata because lockfile state and ignore rules are narrow, reversible changes.",
          "evidence": "The charter excludes UI redesign, protocol changes, runtime services, and package-manager changes.",
          "falsifier": "If npm install failure comes from local environment state or requires dependency strategy changes, stop or pivot.",
          "stance": "SUPPORT",
          "topic_key": "feasibility"
        },
        {
          "claim": "The proposed proof is sufficient because it checks install, type safety, production build, repo tests, repo checks, and git cleanliness.",
          "evidence": "CHARTER.md requires npm ci, npm run typecheck, npm run build:web, python3 scripts/test.py, python3 scripts/check_repo.py, and git status --short.",
          "falsifier": "If those commands pass only with untracked generated outputs, local-only files, or skipped UI checks, proof is insufficient.",
          "stance": "SUPPORT",
          "topic_key": "proof-sufficiency"
        },
        {
          "claim": "The scope is minimal: normalize the public npm lockfile and ignore generated dependency/build outputs without touching product behavior.",
          "evidence": "The charter and SPEC constrain the work to REQ-001 and forbid UI redesign, protocol changes, runtime dependencies, and new services.",
          "falsifier": "Any implementation that changes UI behavior, state-machine semantics, package manager, runtime dependencies, or mission artifacts exceeds the milestone.",
          "stance": "SUPPORT",
          "topic_key": "scope-minimality"
        }
      ],
      "cut": "Cut UI redesign, protocol-gate changes, package-manager changes, Python runtime dependency changes, generated artifact churn, and unrelated cleanup.",
      "first_move": "Run the acceptance commands and inspect git status, then change only lockfile or ignore rules required by the failing evidence.",
      "identity": {
        "context_id": "council-advisor-2-context",
        "model": "current",
        "participant_id": "advisor-2",
        "provider": "codex-multi-agent"
      },
      "independent_first_round": true,
      "null_hypothesis": "Do not proceed if the observed npm failure is local-environment-specific or already solved by the committed public lockfile.",
      "verdict": "PROCEED"
    }
  ],
  "artifact_hashes": {
    "charter": "1fcd550fcf39758db6a8fc8c9ab6749cc2b1dc079c6e803b0f30948741b8941d",
    "goal": "6e7f54e476dad417eddaba260ae1ddd707fb189129ce51df2ac12432dff39d2c",
    "spec": "4c0e10c8c9b21d2b333f2620f8e0c6ebc2c139a49cf63fb5c67f74a20229c14d"
  },
  "claim_registry": [
    "mission-value",
    "feasibility",
    "proof-sufficiency",
    "scope-minimality"
  ],
  "decision": {
    "chair": {
      "context_id": "council-chair-main-context",
      "model": "gpt-5.5-codex",
      "participant_id": "chair",
      "provider": "codex"
    },
    "conflict_resolutions": [],
    "first_slice": "Normalize package-lock resolved registry URLs and ignore generated UI dependency/build outputs; verify npm install, typecheck, build, tests, repo check, and git status.",
    "rationale": "Both independent advisors support proceeding because the observed npm install failure maps to repository metadata and the proof is concrete. The slice excludes UI behavior, protocol, runtime dependency, and package-manager changes.",
    "verdict": "PROCEED"
  },
  "mission_id": "mission-20260625-051108-2c506d76",
  "schema_version": 1
}
