{
  "advisors": [
    {
      "claims": [
        {
          "claim": "The combined slice directly serves the mission because first-run UI install, generated-output cleanliness, and Signoff receipt filtering are all part of the single user-visible success condition.",
          "evidence": "CHARTER.md says success requires npm ci, UI typecheck/build, generated outputs out of git status, and receipts showing only the authorized product patch rather than .signoff control artifacts.",
          "falsifier": "If any of the three fixes is unrelated to clone-to-build reproducibility or patch receipt accuracy, split it out.",
          "stance": "SUPPORT",
          "topic_key": "mission-value"
        },
        {
          "claim": "The slice is feasible without changing UI behavior, protocol semantics, runtime dependencies, or installation shape.",
          "evidence": "The charter frames the needed work as repository metadata, generated-output ignores, and consistent filtering of existing control paths.",
          "falsifier": "If npm ci fails because of local environment constraints or receipt filtering needs protocol-model changes, stop or pivot.",
          "stance": "SUPPORT",
          "topic_key": "feasibility"
        },
        {
          "claim": "The required proof is sufficient and concrete: install/build/test commands plus a conformance test for PATCH.diff filtering and git status checks for generated outputs.",
          "evidence": "The charter requires npm ci, npm run typecheck, npm run build:web, python3 scripts/test.py, python3 scripts/check_repo.py, generated-output git status checks, and a conformance test proving sealed PATCH.diff excludes .signoff artifacts.",
          "falsifier": "If the tests only prove happy-path build success and do not inspect PATCH.diff or git status after generated outputs, proof is insufficient.",
          "stance": "SUPPORT",
          "topic_key": "proof-sufficiency"
        },
        {
          "claim": "The route is narrow enough: fix only public npm lockfile reproducibility, generated-output ignores, and receipt filtering.",
          "evidence": "Non-goals explicitly exclude UI redesign, package-manager changes, runtime dependencies, services, broad cleanup, and protocol semantic changes.",
          "falsifier": "If implementation touches UI behavior, adds dependencies, introduces a new package manager, or rewrites protocol semantics, the slice is too broad.",
          "stance": "SUPPORT",
          "topic_key": "scope-minimality"
        }
      ],
      "cut": "Cut UI redesign, package-manager replacement, runtime dependencies, service additions, protocol-model changes, and broad cleanup.",
      "first_move": "Run the smallest repro from a clean state: npm ci, npm run typecheck, npm run build:web, then inspect git status and sealed PATCH.diff contents.",
      "identity": {
        "context_id": "council-r2-advisor-1-context",
        "model": "current",
        "participant_id": "advisor-r2-1",
        "provider": "codex-multi-agent"
      },
      "independent_first_round": true,
      "null_hypothesis": "Do nothing if npm reproducibility is only a local environment issue or if generated-output cleanliness and receipt filtering already pass the required checks.",
      "verdict": "PROCEED"
    },
    {
      "claims": [
        {
          "claim": "The mission directly improves first-run contributor reliability by making the UI install/build path reproducible from the public npm lockfile and keeping generated outputs out of status.",
          "evidence": "The sealed goal and AC-001 require clone, npm ci, UI typecheck, production build, generated-output cleanliness, and PATCH.diff exclusion of .signoff control artifacts.",
          "falsifier": "If npm ci/typecheck/build already work from a clean checkout and generated outputs plus .signoff artifacts already stay out of git status and receipts, the mission would add no value.",
          "stance": "SUPPORT",
          "topic_key": "mission-value"
        },
        {
          "claim": "A narrow patch can satisfy the mission without changing UI behavior, Python runtime dependencies, package manager, services, or protocol semantics.",
          "evidence": "The charter frames the needed work as repository metadata/ignore hygiene and consistent filtering of existing Signoff control paths.",
          "falsifier": "If public npm reproducibility is blocked by the local environment or excluding .signoff artifacts requires protocol-model changes, the slice is not feasible as stated.",
          "stance": "SUPPORT",
          "topic_key": "feasibility"
        },
        {
          "claim": "The evidence standard is sufficient because it combines install/build commands, Python repo checks, git-status cleanliness checks, and a conformance test for sealed PATCH.diff filtering.",
          "evidence": "The charter explicitly requires npm ci, npm run typecheck, npm run build:web, python3 scripts/test.py, python3 scripts/check_repo.py, generated-output git status checks, and a conformance test proving PATCH.diff excludes .signoff control artifacts.",
          "falsifier": "If the tests do not run from a clean checkout or the conformance test does not inspect sealed PATCH.diff contents for .signoff paths, proof would be incomplete.",
          "stance": "SUPPORT",
          "topic_key": "proof-sufficiency"
        },
        {
          "claim": "The combined narrow slice is minimal: fix Signoff patch receipt filtering, public npm lockfile reproducibility, and generated-output ignores.",
          "evidence": "The sealed charter names exactly those success conditions and lists non-goals excluding UI redesign, package-manager changes, runtime dependencies, services, and broad cleanup.",
          "falsifier": "If implementation adds alternate install paths, UI behavior changes, runtime dependencies, or broad refactors beyond receipt filtering and repo metadata, it exceeds the mission scope.",
          "stance": "SUPPORT",
          "topic_key": "scope-minimality"
        }
      ],
      "cut": "Cut UI redesign, new package managers, Python runtime dependencies, services, broad cleanup, and protocol-model changes not strictly required for excluding .signoff control artifacts from receipts.",
      "first_move": "Run npm ci, npm run typecheck, npm run build:web, then inspect git status and sealed PATCH.diff contents to identify metadata/filtering gaps.",
      "identity": {
        "context_id": "council-r2-advisor-2-context",
        "model": "current",
        "participant_id": "advisor-r2-2",
        "provider": "repoprompt-oracle"
      },
      "independent_first_round": true,
      "null_hypothesis": "Do not proceed if the current public npm lockfile already supports clean npm ci/typecheck/build and git status is clean after generated outputs, or if receipt correctness requires protocol semantic changes.",
      "verdict": "PROCEED"
    }
  ],
  "artifact_hashes": {
    "charter": "1352d5d7d7caabdad301779474fbfc4bf7811dfb66e01db243722198b76cd593",
    "goal": "6e7f54e476dad417eddaba260ae1ddd707fb189129ce51df2ac12432dff39d2c",
    "spec": "e3b74e06d293c8281442a0dc61deb5bc3f5197b91183a4e38f352278596dedfe"
  },
  "claim_registry": [
    "mission-value",
    "feasibility",
    "proof-sufficiency",
    "scope-minimality"
  ],
  "decision": {
    "chair": {
      "context_id": "council-r2-chair-main-context",
      "model": "gpt-5.5-codex",
      "participant_id": "chair-r2",
      "provider": "codex"
    },
    "conflict_resolutions": [],
    "first_slice": "Fix patch receipt filtering, normalize package-lock public registry URLs, ignore generated UI outputs, and prove with npm install/typecheck/build, conformance tests, repo checks, and clean generated-output status.",
    "rationale": "Both independent advisors support proceeding because receipt filtering, lockfile reproducibility, and generated-output cleanliness are necessary parts of the same first-run contributor outcome. No conflicts were raised.",
    "verdict": "PROCEED"
  },
  "mission_id": "mission-20260625-051108-2c506d76",
  "schema_version": 1
}
